{
  "BOT_TOKEN": "YOUR_TELEGRAM_BOT_TOKEN",
  "CHAT_ID": "YOUR_TELEGRAM_CHAT_ID",
  "BASE_CAPITAL": 5000,
  "MAX_DAILY_LOSS": -2000,
  "MAX_DRAWDOWN": 0.3,
  "RISK_MODE": "FIXED",
  "RISK_FIXED_AMOUNT": 150,
  "RISK_PER_TRADE": 0.03,
  "MAX_LOT_CAPITAL_PCT": 0.8,
  "MAX_OPEN": 1,
  "MAX_TRADES_DAY": 3,
  "BROKERAGE_PER_TRADE": 40,
  "MIN_NET_RR": 1.5,
  "DAILY_TARGET": 400,
  "TAKE_PROFIT_AND_STOP": true,
  "PARTIAL_EXIT_ENABLED": true,
  "SL_WARN_PCT": 0.92,
  "MIN_TRADE_DURATION_MINS": 40,
  "BROKER_API_ENABLED": false,
  "KITE_API_KEY": "",
  "KITE_ACCESS_TOKEN": "",
  "KITE_USER_ID": "",
  "KITE_PASSWORD": "",
  "KITE_TOTP_KEY": "",
  "BROKER_NAME": "My Broker",
  "BROKER_DRIVER": "KITE",
  "BROKER_BACKEND": "KITE",
  "BROKER_CUSTOM_FACTORY": "",
  "BROKER_WAIT_POLL_SEC": 2.0,
  "BROKER_CONFIG": {
    "api_key": "",
    "access_token": "",
    "user_id": "",
    "password": "",
    "totp_key": "",
    "refresh_token": "",
    "client_id": "",
    "secret": ""
  },
  "ANGEL_API_KEY": "",
  "ANGEL_CLIENT_ID": "",
  "ANGEL_PASSWORD": "",
  "ANGEL_TOTP_KEY": "",
  "ANGEL_REFRESH_TOKEN": "",
  "SL_PCT": 0.85,
  "TARGET_PCT": 1.35,
  "TRAIL_PCT": 0.92,
  "TRAIL_ACTIVATE": 1.12,
  "PARTIAL_EXIT_MULT": 1.18,
  "PARTIAL_EXIT_TRAIL": 1.06,
  "SLIPPAGE": 0.003,
  "AI_THRESHOLD": 60,
  "IV_SPIKE_THRESHOLD": 70.0,
  "VOL_RATIO_MIN": 1.2,
  "COOLDOWN": 300,
  "SCAN_INTERVAL": 90,
  "SUMMARY_INTERVAL": 600,
  "BREAKOUT_TIMEOUT": 1800,
  "SIGNAL_MAX_AGE": 90,
  "MAX_POSITION_AGE": 120,
  "LTP_FREEZE_THRESHOLD": 10,
  "VIX_HALT_THRESHOLD": 30.0,
  "VIX_BLOCK_THRESHOLD": 40.0,
  "MAX_BREAKOUT_DISTANCE": 0.015,
  "LOCK_TRIGGER_PCT": 0.04,
  "TRAIL_STEP_PCT": 0.02,
  "NSE_SESSION_RESET_THRESHOLD": 10,
  "TG_MAX_PER_MIN": 20,
  "WATCHDOG_TIMEOUT": 300,
  "EXCEPTION_ALERT_THRESHOLD": 10,
  "SHUTDOWN_ON_UI_CLOSE": true,
  "PAPER_TRACK_CAPITAL": true,
  "TG_TRADE_ALERTS_STRICT": true,
  "TG_PERIODIC_SUMMARY_TELEGRAM": false,
  "DASHBOARD_COMPACT": true,
  "LOG_PERIODIC_SUMMARY": false,
  "USER_TIPS_ON_START": true,
  "TG_QUIET_MODE": true,
  "TG_SIGNAL_COOLDOWN": 900,
  "RSI_OVERBOUGHT": 70,
  "RSI_OVERSOLD": 30,
  "MIN_OPTION_OI": 500,
  "MIN_OPTION_VOLUME": 100,
  "MAX_POSITIONS_PER_SECTOR": 1,
  "SCAN_BATCH_SIZE": 10,
  "SCAN_BATCH_DELAY": 3,
  "STOCK_WATCHLIST": [],
  "CIRCUIT_BREAKER_THRESHOLD": 15,
  "CIRCUIT_BREAKER_WINDOW": 300,
  "SLIPPAGE_VIX_FACTOR": 0.0002,
  "SLIPPAGE_LOW_VOL_EXTRA": 0.002,
  "ADX_CHOP_THRESHOLD": 20.0,
  "ADX_TREND_THRESHOLD": 25.0,
  "DYNAMIC_SL_ATR_MULT": 2.0,
  "DYNAMIC_TARGET_ATR_MULT": 3.5,
  "TG_FALLBACK_FILE": "tg_fallback_alerts.log",
  "TG_STARTUP_ALERT": false,
  "TG_TRADE_ONLY": true,
  "TG_CACHE_TTL_SEC": 55,
  "TG_SIGNAL_GLOBAL_COOLDOWN_SEC": 120,
  "TG_TRADE_CRITICAL_PATTERNS": null,
  "STOCK_ALERT_MODE": "OPTIONS",
  "EQUITY_SL_MOVE_PCT": 0.02,
  "EQUITY_TP_MOVE_PCT": 0.04,
  "LATENCY_BUDGET_MS": 2000,
  "DATA_CROSS_VALIDATE": true,
  "CROSS_VALIDATE_TOLERANCE": 0.02,
  "VIX_SIZE_HIGH_THRESHOLD": 35.0,
  "VIX_SIZE_MED_THRESHOLD": 25.0,
  "WEEKDAY_BIAS": {
    "Monday": 0.88,
    "Tuesday": 1.0,
    "Wednesday": 1.0,
    "Thursday": 1.0,
    "Friday": 0.92
  },
  "VIX_RISING_THRESHOLD_BONUS": 5,
  "VIX_FALLING_COOLDOWN_MULT": 0.5,
  "RECONCILE_INTERVAL": 90,
  "EXIT_RECON_MAX_AGE_SEC": 10,
  "API_FAIL_BLOCK_NEW_ENTRIES": 0,
  "EXIT_SPREAD_GUARD_MULT": 1.5,
  "FORCE_PRE_TRADE_RECON": true,
  "ORDER_STATUS_VERIFY_RETRIES": 3,
  "API_DEGRADE_REDUCE_SIZE_AT": 8,
  "API_DEGRADE_SIZE_MULT": 0.5,
  "API_DEGRADE_BLOCK_ENTRIES_AT": 16,
  "API_DEGRADE_HALT_AT": 32,
  "CONFIG_DRIFT_AUTO_RELOAD": true,
  "RECONCILE_HALT_ON_QTY_MISMATCH": true,
  "PORTFOLIO_MAX_SL_RISK_PCT": 0.75,
  "BROKER_LATENCY_ENFORCE_ORDER": true,
  "METRICS_PORT": 0,
  "METRICS_BIND": "127.0.0.1",
  "ADAPTIVE_THRESHOLD_ENABLED": true,
  "ADAPTIVE_HISTORY_LOOKBACK": 40,
  "ADAPTIVE_THRESHOLD_MAX_BONUS": 8,
  "ADAPTIVE_THRESHOLD_MAX_DISCOUNT": 3,
  "LEARNING_SCORE_ADJ_CLAMP": 20,
  "NSE_CASH_SESSION_START_HOUR": 9,
  "NSE_CASH_SESSION_START_MINUTE": 15,
  "NSE_CASH_SESSION_END_HOUR": 15,
  "NSE_CASH_SESSION_END_MINUTE": 20,
  "NSE_CONTINUOUS_TRADE_START_HOUR": 9,
  "NSE_CONTINUOUS_TRADE_START_MINUTE": 20,
  "NSE_MARKET_STATUS_CLOSED_HOUR": 15,
  "NSE_MARKET_STATUS_CLOSED_MINUTE": 30,
  "NSE_BLOCK_NEW_ENTRIES_FROM_HOUR": 15,
  "NSE_BLOCK_NEW_ENTRIES_FROM_MINUTE": 0,
  "NSE_POST_OPEN_NO_TRADE_MINUTES": 10,
  "NSE_EARLY_SESSION_END_HOUR": 10,
  "NSE_EARLY_SESSION_END_MINUTE": 15
}
